<?xml version="1.0" encoding="ISO-8859-1"?>
<creatures xmlns="stendhal" xmlns:xsi="http://www.w3.org/2001/XMLSchema-instance"
    xsi:schemaLocation="stendhal ../creatures.xsd ">
    
  <creature name="chick">
    <type class="farm_animal" subclass="chick" tileid="farm_animal.png:2"/>
    <description>You see a little chick, it doesn't like to be away from its mother.</description>
    <attributes>
      <atk value="32"/>
      <def value="7"/>
      <hp value="25"/>
      <speed value="0.5"/>
      <size value="1,1"/>
    </attributes>
    <level value="1"/>
    <experience value="5"/>
    <respawn value="900"/>
    <corpse name="small_winged" harmless="feathered" />
    <drops>
      <item value="chicken" quantity="[1,1]" probability="70.0"/>
    </drops>
    <equips>
    </equips>
    <ai>
      <says>
        <noise state="idle follow fight" value="peep peep"/>
        <noise state="idle follow fight" value="peep peep peep"/>
        <sound value="chicken-chick-1" />
        <sound value="chicken-chick-2" />
      </says>
      <profile name="animal"/>
      <profile name="patrolling"/>
      <profile name="non offensive"/>
      <profile name="coward"/>
    </ai>
  </creature>

  <creature name="piglet">
    <type class="farm_animal" subclass="piglet" tileid="farm_animal.png:9"/>
    <description>You see a piglet, a bit dirty.</description>
    <attributes>
      <atk value="31"/>
      <def value="7"/>
      <hp value="25"/>
      <speed value="0.6"/>
      <size value="1,1"/>
    </attributes>
    <level value="1"/>
    <experience value="5"/>
    <respawn value="900"/>
    <corpse name="animal"/>
    <drops>
      <item value="ham" quantity="[1,1]" probability="70.0"/>
    </drops>
    <equips>
    </equips>
    <ai>
      <says>
        <noise state="idle follow fight" value="oink"/>
        <noise state="idle follow fight" value="oink oink"/>
        <noise state="idle follow fight" value="shnuffle"/>
        <sound value="pig-3" />
      </says>
      <profile name="animal"/>
      <profile name="patrolling"/>
    </ai>
  </creature>
  
  
  <creature name="mother hen">
    <type class="farm_animal" subclass="hen" tileid="farm_animal.png:6"/>
    <description>You see a mother hen, she will probably hurt you if you touch her sons.</description>
    <attributes>
      <atk value="29"/>
      <def value="6"/>
      <hp value="25"/>
      <speed value="0.7"/>
      <size value="1,1"/>
    </attributes>
    <level value="1"/>
    <experience value="5"/>
    <respawn value="900"/>
    <corpse name="small_winged" harmless="feathered" />
    <drops>
      <item value="chicken" quantity="[1,2]" probability="70.0"/>
    </drops>
    <equips>
    </equips>
    <ai>
      <says>
        <noise state="idle follow fight" value="peep peep"/>
        <noise state="idle follow fight" value="peep peep peep"/>
        <sound value="chicken-1"/>
      </says>
      <profile name="animal"/>
      <profile name="patrolling"/>
      <profile name="non offensive"/>
    </ai>
  </creature>
  
   <creature name="ram">
    <type class="farm_animal" subclass="ram" tileid="farm_animal.png:10"/>
    <description>You see a ram, maybe you are able to shear it?</description>
    <attributes>
      <atk value="52"/>
      <def value="7"/>
      <hp value="50"/>
      <speed value="0.5"/>
      <size value="1,1"/>
    </attributes>
    <level value="2"/>
    <experience value="20"/>
    <respawn value="900"/>
    <corpse name="animal"/>
    <drops>
      <item value="meat" quantity="[1,1]" probability="40.0"/>
    </drops>
    <equips>
    </equips>
    <ai>
      <says>
        <noise state="idle follow fight" value="Baaaaaa"/>
      </says>
      <profile name="animal"/>
      <profile name="offensive"/>
    </ai>
  </creature>
  
   <creature name="beaver">
    <type class="farm_animal" subclass="beaver" tileid="farm_animal.png:0"/>
    <description>You see a beaver. It likes to build dams in the river.</description>
    <attributes>
      <atk value="53"/>
      <def value="8"/>
      <hp value="35"/>
      <speed value="0.6"/>
      <size value="1,1"/>
    </attributes>
    <level value="2"/>
    <experience value="20"/>
    <respawn value="900"/>
    <corpse name="animal"/>
    <drops>
      <item value="meat" quantity="[1,2]" probability="80.0"/>
      <item value="wood" quantity="[1,2]" probability="20.0"/>
    </drops>
    <equips>
    </equips>
    <ai>
      <profile name="animal"/>
      <profile name="offensive"/>
      <profile name="patrolling"/>
    </ai>
  </creature>

  <creature name="cow">
    <type class="farm_animal" subclass="cow" tileid="farm_animal.png:3"/>
    <description>You see a cow, taste her delicious milk.</description>
    <attributes>
      <atk value="51"/>
      <def value="9"/>
      <hp value="30"/>
      <speed value="0.3"/>
      <size value="1,1"/>
    </attributes>
    <level value="2"/>
    <experience value="20"/>
    <respawn value="900"/>
    <corpse name="animal"/>
    <drops>
      <item value="meat" quantity="[1,2]" probability="80.0"/>
    </drops>
    <equips>
    </equips>
    <ai>
      <says>
        <noise state="idle follow fight" value="Moooo       moooo           mooooooo"/>
        <noise state="idle follow fight" value="mooooo"/>
        <sound value="cow-1"/>
      </says>
      <profile name="animal"/>
    </ai>
  </creature>

  <creature name="goat">
    <type class="farm_animal" subclass="goat" tileid="farm_animal.png:4"/>
    <description>You see a goat, which is wild and lives in the mountain.</description>
    <attributes>
      <atk value="52"/>
      <def value="9"/>
      <hp value="30"/>
      <speed value="0.3"/>
      <size value="1,1"/>
    </attributes>
    <level value="2"/>
    <experience value="20"/>
    <respawn value="900"/>
    <corpse name="animal"/>
    <drops>
      <item value="meat" quantity="[1,2]" probability="80.0"/>
    </drops>
    <equips>
    </equips>
    <ai>
      <says>
        <sound value="goat-1" />
        <sound value="goat-2" />
      </says>
      <profile name="animal"/>
      <profile name="offensive"/>
      <profile name="patrolling"/>
    </ai>
  </creature>

  <creature name="horse">
    <type class="farm_animal" subclass="horse" tileid="farm_animal.png:7"/>
    <description>You see a horse, don't slap it or it will run away!</description>
    <attributes>
      <atk value="48"/>
      <def value="10"/>
      <hp value="30"/>
      <speed value="1.0"/>
      <size value="1,1"/>
    </attributes>
    <level value="2"/>
    <experience value="20"/>
    <respawn value="900"/>
    <corpse name="animal"/>
    <drops>
      <item value="meat" quantity="[1,2]" probability="80.0"/>
    </drops>
    <equips>
    </equips>
    <ai>
      <says>
        <noise state="idle follow fight" value="neigghhh neigghhh"/>
        <sound value="horse-1" />
        <sound value="horse-2" />
      </says>
      <profile name="animal"/>
      <profile name="non offensive"/>
      <profile name="patrolling"/>
    </ai>
  </creature>

  <creature name="white horse">
    <type class="farm_animal" subclass="white_horse" tileid="farm_animal.png:11"/>
    <description>You see a white horse, they love to stay with their brown friends.</description>
    <attributes>
      <atk value="50"/>
      <def value="9"/>
      <hp value="30"/>
      <speed value="1.0"/>
      <size value="1,1"/>
    </attributes>
    <level value="2"/>
    <experience value="20"/>
    <respawn value="900"/>
    <corpse name="animal"/>
    <drops>
      <item value="meat" quantity="[1,2]" probability="80.0"/>
    </drops>
    <equips>
    </equips>
    <ai>
      <says>
        <noise state="idle follow fight" value="naayyy"/>
        <sound value="horse-1" />
        <sound value="horse-2" />
      </says>
      <profile name="animal"/>
      <profile name="non offensive"/>
      <profile name="patrolling"/>
    </ai>
  </creature>
  
   <creature name="bull">
    <type class="farm_animal" subclass="bull" tileid="farm_animal.png:1"/>
    <description>You see a bull, run away!!!</description>
    <attributes>
      <atk value="47"/>
      <def value="9"/>
      <hp value="35"/>
      <speed value="0.9"/>
      <size value="1,1"/>
    </attributes>
    <level value="2"/>
    <experience value="20"/>
    <respawn value="900"/>
    <corpse name="animal"/>
    <drops>
      <item value="meat" quantity="[1,3]" probability="80.0"/>
    </drops>
    <equips>
    </equips>
    <ai>
      <says>
        <noise state="idle follow fight" value="MOOOOO!!!"/>
        <sound value="cow-2" />
      </says>
      <profile name="animal"/>
      <profile name="offensive"/>
      <profile name="patrolling"/>
    </ai>
  </creature>

  <creature name="grass snake">
    <type class="farm_animal" subclass="grass_snake" tileid="farm_animal.png:5"/>
    <description>You see a grass snake which is quite dangerous.</description>
    <attributes>
      <atk value="68"/>
      <def value="15"/>
      <hp value="35"/>
      <speed value="0.6"/>
      <size value="1,1"/>
    </attributes>
    <level value="3"/>
    <experience value="30"/>
    <respawn value="900"/>
    <corpse name="small_boneless"/>
    <drops>
      <item value="money" quantity="[2,6]" probability="60.0"/>
      <item value="poison" quantity="[1,1]" probability="10.0"/>
    </drops>
    <equips>
    </equips>
    <ai>
      <says>
        <noise state="idle follow fight" value="sssSSSsssss..."/>
        <sound value="snake-1"/>
      </says>
      <profile name="poisonous" params="5,poison"/>
      <profile name="animal"/>
      <profile name="offensive"/>
      <profile name="patrolling"/>
    </ai>
  </creature>
  
</creatures>