<?xml version="1.0" encoding="ISO-8859-1"?>
<creatures xmlns="stendhal" xmlns:xsi="http://www.w3.org/2001/XMLSchema-instance"
    xsi:schemaLocation="stendhal ../creatures.xsd ">

  <creature name="wooden golem">
    <type class="golem" subclass="wooden_golem" tileid="golem.png:1"/>
    <description>You see a wooden golem. The scroll with ancient words in his head keeps it walking.</description>
    <attributes>
      <atk value="251"/>
      <def value="34"/>
      <hp value="223"/>
      <speed value="0.3"/>
      <size value="1,1"/>
    </attributes>
    <level value="24"/>
    <experience value="370"/>
    <respawn value="1290"/>
    <corpse name="wooden" harmless="wooden" />
    <drops>
      <item value="money" quantity="[5,19]" probability="100.0"/>
      <item value="wood" quantity="[1,2]" probability="15.0"/>
    </drops>
    <equips>
    </equips>
    <abilities>
      <susceptibility type="fire" value="1.2"/>
    </abilities>
    <ai>
      <profile name="brave"/>
      <profile name="animal"/>
      <profile name="offensive"/>
      <profile name="heal" params="5,50"/>
      <profile name="patrolling"/>
    </ai>
  </creature>

  <creature name="stone golem">
    <type class="golem" subclass="stone_golem" tileid="golem.png:0"/>
    <description>You see a stone golem, it exists to protect and nothing else. What was it crafted to protect, and what would one do if it lost it's purpose?</description>
    <attributes>
      <atk value="297"/>
      <def value="85"/>
      <hp value="95"/>
      <speed value="0.6"/>
      <size value="1,1"/>
    </attributes>
    <level value="32"/>
    <experience value="640"/>
    <respawn value="1380"/>
    <corpse name="rock" harmless="rock" />
    <drops>
      <item value="money" quantity="[5,27]" probability="100.0"/>
      <item value="stone cloak" quantity="[1,1]" probability="2.5"/>
      <item value="stone boots" quantity="[1,1]" probability="0.5"/>
    </drops>
    <equips>
    </equips>
    <abilities>
      <susceptibility type="ice" value="0.9"/>
      <susceptibility type="fire" value="0.9"/>
    </abilities>
    <ai>
      <says>
        <sound value="loop-grind-stone-1" />
      </says>
      <profile name="brave"/>
      <profile name="animal"/>
      <profile name="offensive"/>
      <profile name="heal" params="5,50"/>
      <profile name="patrolling"/>
    </ai>
  </creature>
  
  <creature name="ice golem">
    <type class="golem" subclass="ice_golem" tileid="golem.png:2"/>
    <description>You see an Ice golem. Ice Golems are elementals made out of ice. You should watch out for its icy fists or you might get hurt.</description>
    <attributes>
      <atk value="381"/>
      <def value="53"/>
      <hp value="390"/>
      <speed value="0.6"/>
      <size value="1,1"/>
    </attributes>
    <level value="45"/>
    <experience value="1360"/>
    <respawn value="1620"/>
    <corpse name="puddle_light_blue"/>
    <drops>
      <item value="money" quantity="[5,27]" probability="100.0"/>
      <item value="snowball" quantity="[1,4]" probability="75"/>
      <item value="ice sword" quantity="[1,1]" probability="0.05"/>
      <item value="ice armor" quantity="[1,1]" probability="0.005"/>
    </drops>
    <equips>
    </equips>
    <abilities>
      <damage type="ice"/>
      <susceptibility type="ice" value="0.5"/>
      <susceptibility type="fire" value="1.5"/>
    </abilities>
    <ai>
      <profile name="brave"/>
      <profile name="animal"/>
      <profile name="offensive"/>
      <profile name="heal" params="5,50"/>
      <profile name="patrolling"/>
    </ai>
  </creature>    
   
</creatures>  