<?xml version="1.0" encoding="ISO-8859-1"?>
<creatures xmlns="stendhal" xmlns:xsi="http://www.w3.org/2001/XMLSchema-instance"
    xsi:schemaLocation="stendhal ../creatures.xsd ">
    
  <creature name="gargoyle">
    <type class="gargoyle" subclass="gargoyle" tileid="gargoyle.png:2"/>
    <description>You see a gargoyle, You should think that it is a statue, but no, it is alive!</description>
    <attributes>
      <atk value="98"/>
      <def value="16"/>
      <hp value="70"/>
      <speed value="0.9"/>
      <size value="1,1"/>
    </attributes>
    <level value="6"/>
    <experience value="60"/>
    <respawn value="1200"/>
    <corpse name="humanoid"/>
    <drops>
      <item value="money" quantity="[2,10]" probability="90.0"/>
    </drops>
    <equips>
    </equips>
    <ai>
      <says>
      	<sound value="hyena-1"/>
      	<sound value="hyena-2"/>
      	<sound value="hyena-3"/>
      </says>
      <profile name="brave"/>
      <profile name="offensive"/>
      <profile name="human"/>
    </ai>
  </creature>
  
  <creature name="elder gargoyle">
    <type class="gargoyle" subclass="elder_gargoyle" tileid="gargoyle.png:1"/>
    <description>You see an elder gargoyle, it is wise...</description>
    <attributes>
      <atk value="114"/>
      <def value="16"/>
      <hp value="100"/>
      <speed value="0.4"/>
      <size value="1,1"/>
    </attributes>
    <level value="8"/>
    <experience value="80"/>
    <respawn value="1200"/>
    <corpse name="humanoid"/>
    <drops>
      <item value="money" quantity="[4,12]" probability="90.0"/>
      <item value="mace" quantity="[1,1]" probability="30.0"/>
    </drops>
    <equips>
    </equips>
    <ai>
      <says>
        <sound value="loop-grind-stone-1" />
      </says>
      <profile name="brave"/>
      <profile name="offensive"/>
      <profile name="human"/>
    </ai>
  </creature>
  
  <creature name="dark gargoyle">
    <type class="gargoyle" subclass="dark_gargoyle" tileid="gargoyle.png:0"/>
    <description>You see a dark gargoyle, do you feel the fear?</description>
    <attributes>
      <atk value="134"/>
      <def value="22"/>
      <hp value="93"/>
      <speed value="1.0"/>
      <size value="1,1"/>
    </attributes>
    <level value="10"/>
    <experience value="110"/>
    <respawn value="1210"/>
    <corpse name="humanoid"/>
    <drops>
      <item value="money" quantity="[4,17]" probability="90.0"/>
      <item value="chain armor" quantity="[1,1]" probability="3.0"/>
      <item value="enhanced chainmail" quantity="[1,1]" probability="0.05"/>
      <item value="enhanced mace" quantity="[1,1]" probability="5.0"/>
    </drops>
    <equips>
    </equips>
    <ai>
      <profile name="brave"/>
      <profile name="offensive"/>
      <profile name="human"/>
    </ai>
  </creature>  
  
  <creature name="venom gargoyle">
    <type class="gargoyle" subclass="venom_gargoyle" tileid="gargoyle.png:3"/>
    <description>You see a venom gargoyle, a hideous and poisonous creature.</description>
    <attributes>
      <atk value="188"/>
      <def value="61"/>
      <hp value="55"/>
      <speed value="0.9"/>
      <size value="1,1"/>
    </attributes>
    <level value="16"/>
    <experience value="200"/>
    <respawn value="1230"/>
    <corpse name="humanoid"/>
    <drops>
      <item value="money" quantity="[10,25]" probability="90.0"/>
      <item value="enhanced chainmail" quantity="[1,1]" probability="10.0"/>
      <item value="scale armor" quantity="[1,1]" probability="2.0"/>
      <item value="iron scale armor" quantity="[1,1]" probability="0.4"/>
      <item value="poison" quantity="[1,1]" probability="15.0"/>
    </drops>
    <equips>
    </equips>
    <ai>
      <profile name="poisonous" params="15,poison"/>
      <profile name="brave"/>
      <profile name="offensive"/>
      <profile name="human"/>
      <profile name="patrolling"/>
    </ai>
  </creature> 
  
</creatures>  