<?xml version="1.0" encoding="ISO-8859-1"?>

<creatures xmlns="stendhal" xmlns:xsi="http://www.w3.org/2001/XMLSchema-instance"
    xsi:schemaLocation="stendhal ../creatures.xsd">

  <!-- START: oni -->

  <creature name="oni warrior">
    <type class="oni" subclass="oni_warrior" tileid="oni.png:0"/>
    <description>You see an oni warrior. His purple skin colour should not lull you into a false sense of security!</description>
    <attributes>
      <atk value="499"/>
      <def value="77"/>
      <hp value="500"/>
      <speed value="0.9"/>
      <size value="1,1"/>
    </attributes>
    <level value="67"/>
    <experience value="3660"/>
    <respawn value="2000"/>
    <corpse name="humanoid"/>
    <drops>
      <item value="money" quantity="[10,50]" probability="90.0"/>
      <item value="shadow legs" quantity="[1,1]" probability="0.8"/>
      <item value="shadow boots" quantity="[1,1]" probability="1.0"/>
      <item value="pie" quantity="[1,2]" probability="5.0"/>
    </drops>
    <equips>
    </equips>
    <ai>
      <profile name="offensive"/>
      <profile name="human"/>
      <profile name="patrolling"/>
    </ai>
  </creature>

  <creature name="oni archer">
    <type class="oni" subclass="oni_archer" tileid="oni.png:1"/>
    <description>You see an oni archer. His arrows will follow you everywhere for protecting his queen!</description>
    <attributes>
      <atk value="511"/>
      <ratk value="511"/>
      <def value="77"/>
      <hp value="600"/>
      <speed value="0.7"/>
      <size value="1,1"/>
    </attributes>
    <level value="72"/>
    <experience value="4000"/>
    <respawn value="2300"/>
    <corpse name="humanoid"/>
    <drops>
      <item value="money" quantity="[10,70]" probability="100.0"/>
      <item value="golden legs" quantity="[1,1]" probability="2.0"/>
      <item value="golden arrow" quantity="[8,15]" probability="5.0"/>
      <item value="golden boots" quantity="[1,1]" probability="2.0"/>
    </drops>
    <equips>
      <slot name="lhand" item="power arrow" quantity="10000"/>
      <slot name="rhand" item="composite bow" quantity="1"/>
    </equips>
    <ai>
      <profile name="offensive"/>
      <profile name="human"/>
      <profile name="archer"/>
      <profile name="patrolling"/>
    </ai>
  </creature>

  <creature name="oni priest">
    <type class="oni" subclass="oni_priest" tileid="oni.png:2"/>
    <description>You see a mysterious oni priest, uttering strange incantations.</description>
    <attributes>
      <atk value="547"/>
      <def value="76"/>
      <hp value="680"/>
      <speed value="0.8"/>
      <size value="1,1"/>
    </attributes>
    <level value="77"/>
    <experience value="5290"/>
    <respawn value="2590"/>
    <corpse name="humanoid"/>
    <drops>
      <item value="greater potion" quantity="[1,2]" probability="50.0"/>
      <item value="money" quantity="[10,40]" probability="100.0"/>
      <item value="shadow boots" quantity="[1,1]" probability="0.5"/>
      <item value="chaos cloak" quantity="[1,1]" probability="0.050"/>
    </drops>
    <equips>
    </equips>
    <ai>
      <profile name="offensive"/>
      <profile name="human"/>
      <profile name="heal" params="5,40"/>
      <profile name="patrolling"/>
    </ai>
  </creature>

  <creature name="oni king">
    <type class="oni" subclass="oni_king" tileid="oni.png:3"/>
    <description>You see the oni king. His power leads brave oni troops around his kingdom.</description>
    <attributes>
      <atk value="714"/>
      <def value="93"/>
      <hp value="1200"/>
      <speed value="0.8"/>
      <size value="1,1"/>
    </attributes>
    <level value="109"/>
    <experience value="14000"/>
    <respawn value="5300"/>
    <corpse name="humanoid"/>
    <drops>
      <item value="money" quantity="[10,70]" probability="100.0"/>
      <item value="greater potion" quantity="[1,1]" probability="30.0"/>
      <item value="gold bar" quantity="[1,1]" probability="3.0"/>
      <item value="horned golden helmet" quantity="[1,1]" probability="1.0"/>
    </drops>
    <equips>
    </equips>
    <ai>
      <says>
        <noise state="idle follow fight" value="Revere me, the Oni King!"/>
      </says>
      <profile name="offensive"/>
      <profile name="human"/>
    </ai>
  </creature>

  <creature name="oni queen">
    <type class="oni" subclass="oni_queen" tileid="oni.png:4"/>
    <description>You see the oni queen. She supports her husband and takes an eye onto their kingdom while he conquers new land and fights on battlefields.</description>
    <attributes>
      <atk value="737"/>
      <def value="98"/>
      <hp value="1200"/>
      <speed value="0.8"/>
      <size value="1,1"/>
    </attributes>
    <level value="118"/>
    <experience value="17000"/>
    <respawn value="6200"/>
    <corpse name="humanoid"/>
    <drops>
      <item value="money" quantity="[10,50]" probability="100.0"/>
      <item value="greater potion" quantity="[1,2]" probability="30.0"/>
      <item value="gold bar" quantity="[1,2]" probability="5.0"/>
      <item value="golden cloak" quantity="[1,1]" probability="1.0"/>
      <item value="liberty helmet" quantity="[1,1]" probability="0.1"/>
      <item value="aventail" quantity="[1,1]" probability="10.0"/>
    </drops>
    <equips>
    </equips>
    <ai>
      <says>
        <noise state="idle follow fight" value="You must bow before the Oni Queen."/>
      </says>
      <profile name="offensive"/>
      <profile name="human"/>
    </ai>
  </creature>

  <!-- END: oni -->

</creatures>
