<?xml version="1.0" encoding="ISO-8859-1"?>
<creatures xmlns="stendhal" xmlns:xsi="http://www.w3.org/2001/XMLSchema-instance"
    xsi:schemaLocation="stendhal ../creatures.xsd ">
    
 <creature name="giantrat">
    <type class="giant_animal" subclass="giantrat" tileid="giant_animal.png:1"/>
    <description>You see a giant rat. It seems like it survived from an experiment which went wrong.</description>
    <attributes>
      <atk value="173"/>
      <def value="30"/>
      <hp value="110"/>
      <speed value="1.0"/>
      <size value="2,2"/>
    </attributes>
    <level value="15"/>
    <experience value="180"/>
    <respawn value="1230"/>
    <corpse name="huge_animal" harmless="tail_rodent_large" width="2" height="2" />
    <drops>
      <item value="money" quantity="[7,20]" probability="100.0"/>
      <item value="cheese" quantity="[3,7]" probability="80.0"/>
    </drops>
    <equips>
    </equips>
    <ai>
      <says>
      	<sound value="bobcat-1"/>
      	<sound value="leopard-11"/>
      </says>
      <profile name="brave"/>
      <profile name="animal"/>
      <profile name="offensive"/>
      <profile name="heal" params="5,150"/>
      <profile name="patrolling"/>
    </ai>
  </creature>
  
   <creature name="crocodile">
    <type class="giant_animal" subclass="crocodile" tileid="giant_animal.png:0"/>
    <description>You see a crocodile, it arises from the deep waters in the rivers.</description>
    <attributes>
      <atk value="172"/>
      <def value="30"/>
      <hp value="110"/>
      <speed value="1.0"/>
      <size value="2,2"/>
    </attributes>
    <level value="15"/>
    <experience value="180"/>
    <respawn value="1230"/>
    <corpse name="huge_animal" width="2" height="2"/>
    <drops>
      <item value="money" quantity="[3,12]" probability="100.0"/>
      <item value="meat" quantity="[3,7]" probability="80.0"/>
      <item value="ham" quantity="[2,5]" probability="50.0"/>
    </drops>
    <equips>
    </equips>
    <ai>
      <says>
        <noise state="idle follow fight" value="Rrrrrrrrr"/>
        <sound value="alligator-1" />
      </says>
      <profile name="brave"/>
      <profile name="animal"/>
      <profile name="offensive"/>
      <profile name="heal" params="5,150"/>
      <profile name="patrolling"/>
    </ai>
  </creature>  
  
  <!-- used to be in giant human folder which is why the tiled image is different -->
  <creature name="dwarf golem">
    <type class="giant_animal" subclass="dwarf_golem" tileid="giant_human.png:5"/>
    <description>You see a dwarf golem. A long time ago a dwarf got turned into a big rock by some mystical forces. To save their friend the other dwarves created a golem out of this rock! From this day the dwarf golem lives together with them.</description>
    <attributes>
      <atk value="939"/>
      <def value="99"/>
      <hp value="2700"/>
      <speed value="1.0"/>
      <size value="3,2"/>
    </attributes>
    <level value="170"/>
    <experience value="50800"/>
    <respawn value="16000"/>
    <corpse name="giant_humanoid" width="2" height="2"/>
    <drops>
      <item value="money" quantity="[30,150]" probability="100.0"/>
      <item value="greater potion" quantity="[1,2]" probability="50.0"/>
      <item value="stone armor" quantity="[1,1]" probability="2.0"/>
      <item value="durin axe" quantity="[1,1]" probability="0.25"/>
      <item value="magic twoside axe" quantity="[1,1]" probability="1.0"/>
    </drops>
    <equips>
    </equips>
    <ai>
      <profile name="brave"/>
      <profile name="animal"/>
      <profile name="offensive"/>
      <profile name="heal" params="5,50"/>
    </ai>
  </creature>
  
</creatures>  