<?xml version="1.0" encoding="ISO-8859-1"?>
<creatures xmlns="stendhal" xmlns:xsi="http://www.w3.org/2001/XMLSchema-instance"
    xsi:schemaLocation="stendhal ../creatures.xsd ">
  
  <creature name="albino elf archer">
    <type class="albino_elf" subclass="albino_elf_archer" tileid="albino_elf.png:0"/>
    <description>You see an albino elf archer. He is so sharp-eyed that he could hit a bee from a distance of 100 meters.</description>
    <attributes>
      <atk value="345"/>
      <def value="94"/>
      <hp value="150"/>
      <speed value="0.7"/>
      <size value="1,1"/>
    </attributes>
    <level value="42"/>
    <experience value="960"/>
    <respawn value="1630"/>
    <corpse name="humanoid"/>
    <drops>
      <item value="money" quantity="[10,30]" probability="90.0"/>
      <item value="studded armor" quantity="[1,1]" probability="2.0"/>
      <item value="steel arrow" quantity="[5,15]" probability="10.0"/>
      <item value="wooden bow" quantity="[1,1]" probability="2.0"/>
    </drops>
    <equips>
      <slot name="lhand" item="steel arrow" quantity="10000"/>
      <slot name="rhand" item="wooden bow" quantity="1"/>
    </equips>
    <ai>
      <profile name="brave"/>
      <profile name="offensive"/>
      <profile name="human"/>
      <profile name="archer"/>
      <profile name="patrolling"/>
    </ai>
  </creature>
  
  <creature name="albino elf king">
    <type class="albino_elf" subclass="albino_elf_king" tileid="albino_elf.png:1"/>
    <description>You see an albino elf king. He is the patriarch of albino elves and won countless of battles with his powerful albino elf army.</description>
    <attributes>
      <atk value="461"/>
      <def value="53"/>
      <hp value="675"/>
      <speed value="0.8"/>
      <size value="1,1"/>
    </attributes>
    <level value="60"/>
    <experience value="2800"/>
    <respawn value="1900"/>
    <corpse name="humanoid"/>
    <drops>
      <item value="money" quantity="[30,60]" probability="100.0"/>
      <item value="shadow armor" quantity="[1,1]" probability="0.5"/>
      <item value="shadow boots" quantity="[1,1]" probability="1.0"/>
      <item value="shadow helmet" quantity="[1,1]" probability="0.35"/>
      <item value="great sword" quantity="[1,1]" probability="0.5"/>
    </drops>
    <equips>
    </equips>
    <ai>
      <profile name="brave"/>
      <profile name="offensive"/>
      <profile name="human"/>
      <profile name="heal" params="5,50"/>
      <profile name="patrolling"/>
    </ai>
  </creature>
  
  <creature name="albino elf magician">
    <type class="albino_elf" subclass="albino_elf_magician" tileid="albino_elf.png:2"/>
    <description>You see an albino elf magician. He knows all the secrets of magic. You'd be better to not let him unleash his full power!</description>
    <attributes>
      <atk value="432"/>
      <def value="58"/>
      <hp value="500"/>
      <speed value="0.7"/>
      <size value="1,1"/>
    </attributes>
    <level value="55"/>
    <experience value="2210"/>
    <respawn value="1600"/>
    <corpse name="humanoid"/>
    <drops>
      <item value="elf cloak" quantity="[1,1]" probability="2.5"/> 
      <item value="greater potion" quantity="[1,2]" probability="20.0"/>
      <item value="money" quantity="[10,70]" probability="100.0"/>
      <item value="empty scroll" quantity="[1,2]" probability="8.0"/>
      <item value="scroll eraser" quantity="[1,1]" probability="0.4"/>
    </drops>
    <equips>
    </equips>
    <ai>
      <profile name="offensive"/>
      <profile name="human"/>
      <profile name="heal" params="10,60"/>
      <profile name="patrolling"/>
    </ai>
  </creature>
  
  <creature name="albino elf queen">
    <type class="albino_elf" subclass="albino_elf_queen" tileid="albino_elf.png:3"/>
    <description>You see an albino elf queen. She is the matriarch of the albino elf race and she will do everything to protect it.</description>
    <attributes>
      <atk value="454"/>
      <def value="48"/>
      <hp value="700"/>
      <speed value="0.9"/>
      <size value="1,1"/>
    </attributes>
    <level value="58"/>
    <experience value="2700"/>
    <respawn value="1800"/>
    <corpse name="humanoid"/>
    <drops>
      <item value="money" quantity="[30,60]" probability="100.0"/>
      <item value="shadow boots" quantity="[1,1]" probability="0.5"/>
      <item value="drow sword" quantity="[1,1]" probability="0.01"/>
    </drops>
    <equips>
    </equips>
    <ai>
      <profile name="brave"/>
      <profile name="offensive"/>
      <profile name="human"/>
      <profile name="heal" params="10,30"/>
      <profile name="patrolling"/>
    </ai>
  </creature>
  
  <creature name="albino elf swordsman">
    <type class="albino_elf" subclass="albino_elf_swordsman" tileid="albino_elf.png:4"/>
    <description>You see an albino elf swordsman who is a professional in using swords. He can attack you from behind in a blink of an eye.</description>
    <attributes>
      <atk value="330"/>
      <def value="57"/>
      <hp value="250"/>
      <speed value="1.0"/>
      <size value="1,1"/>
    </attributes>
    <level value="38"/>
    <experience value="920"/>
    <respawn value="1460"/>
    <corpse name="humanoid"/>
    <drops>
      <item value="money" quantity="[4,40]" probability="100.0"/>
      <item value="golden armor" quantity="[1,1]" probability="0.5"/>
      <item value="golden boots" quantity="[1,1]" probability="0.5"/>
      <item value="golden helmet" quantity="[1,1]" probability="0.35"/>
      <item value="broadsword" quantity="[1,1]" probability="1.5"/>
      <item value="elf cloak" quantity="[1,1]" probability="1.0"/>
    </drops>
    <equips>
    </equips>
    <ai>
      <profile name="offensive"/>
      <profile name="human"/>
      <profile name="patrolling"/>
    </ai>
  </creature>
  
</creatures>  