<?xml version="1.0" encoding="ISO-8859-1"?>

<creatures xmlns="stendhal" xmlns:xsi="http://www.w3.org/2001/XMLSchema-instance"
    xsi:schemaLocation="stendhal ../creatures.xsd ">

  <creature name="poison shroom">
    <type class="mutant" subclass="poison_shroom_small" tileid="mutant.png:6"/>
    <description></description>
    <attributes>
      <atk value="1"/>
      <def value="1"/>
      <hp value="1"/>
      <speed value="1.0"/>
      <size value="1,1"/>
    </attributes>
    <level value="1"/>
    <experience value="1"/>
    <respawn value="1000"/>
    <corpse name="humanoid"/>
    <ai>
      <profile name="brave"/>
      <profile name="offensive"/>
      <profile name="human"/>
      <profile name="patrolling"/>
      <profile name="strategy" params=",outfit_changer(hand_to_hand;poison_shroom_small;poison_shroom),"/>
    </ai>
  </creature>

</creatures>
