<?xml version="1.0" encoding="ISO-8859-1"?>

<creatures xmlns="stendhal" xmlns:xsi="http://www.w3.org/2001/XMLSchema-instance"
    xsi:schemaLocation="stendhal ../creatures.xsd">

  <creature name="mithrilbourgh soldier">
    <type class="human" subclass="mithril_soldier" tileid="human_soldier.png:2"/>
    <description/>
    <attributes>
      <atk value="490"/>
      <def value="78"/>
      <hp value="500"/>
      <speed value="1.0"/>
      <size value="1,1"/>
    </attributes>
    <level value="64"/>
    <experience value="3260"/>
    <respawn value="1960"/>
    <corpse name="humanoid"/>
    <drops>
      <item value="money" quantity="[5,33]" probability="100.0"/>
      <item value="stone boots" quantity="[1,1]" probability="1.5"/>
      <item value="broadsword" quantity="[1,1]" probability="1.0"/>
    </drops>
    <equips>
    </equips>
    <ai>
      <profile name="brave"/>
      <profile name="offensive"/>
      <profile name="human"/>
      <profile name="patrolling"/>
    </ai>
  </creature>

  <creature name="mithrilbourgh archer">
    <type class="human" subclass="mithril_archer" tileid="human_soldier.png:0"/>
    <description/>
    <attributes>
      <atk value="487"/>
      <ratk value="487"/>
      <def value="76"/>
      <hp value="540"/>
      <speed value="0.7"/>
      <size value="1,1"/>
    </attributes>
    <level value="68"/>
    <experience value="3820"/>
    <respawn value="2140"/>
    <corpse name="humanoid"/>
    <drops>
      <item value="money" quantity="[5,53]" probability="100.0"/>
      <item value="golden arrow" quantity="[5,20]" probability="5.0"/>
      <item value="composite bow" quantity="[1,1]" probability="0.5"/>
    </drops>
    <equips>
      <slot name="lhand" item="golden arrow" quantity="10000"/>
      <slot name="rhand" item="composite bow" quantity="1"/>
    </equips>
    <ai>
      <profile name="brave"/>
      <profile name="offensive"/>
      <profile name="human"/>
      <profile name="archer"/>
      <profile name="patrolling"/>
    </ai>
  </creature>

  <creature name="mithrilbourgh knight">
    <type class="human" subclass="mithril_knight" tileid="human_soldier.png:5"/>
    <description/>
    <attributes>
      <atk value="523"/>
      <def value="78"/>
      <hp value="595"/>
      <speed value="1.0"/>
      <size value="1,1"/>
    </attributes>
    <level value="71"/>
    <experience value="4280"/>
    <respawn value="2290"/>
    <corpse name="humanoid"/>
    <drops>
      <item value="money" quantity="[5,33]" probability="100.0"/>
      <item value="dwarvish armor" quantity="[1,1]" probability="1.5"/>
      <item value="stone armor" quantity="[1,1]" probability="0.08"/>
      <item value="chaos boots" quantity="[1,1]" probability="0.08"/>
      <item value="horned golden helmet" quantity="[1,1]" probability="0.5"/>
      <item value="great sword" quantity="[1,1]" probability="0.05"/>
    </drops>
    <equips>
    </equips>
    <ai>
      <profile name="brave"/>
      <profile name="offensive"/>
      <profile name="human"/>
    </ai>
  </creature>

  <creature name="mithrilbourgh elite archer">
    <type class="human" subclass="mithril_elite_archer" tileid="human_soldier.png:3"/>
    <description/>
    <attributes>
      <atk value="500"/>
      <ratk value="500"/>
      <def value="73"/>
      <hp value="608"/>
      <speed value="0.8"/>
      <size value="1,1"/>
    </attributes>
    <level value="72"/>
    <experience value="4450"/>
    <respawn value="2350"/>
    <corpse name="humanoid"/>
    <drops>
      <item value="money" quantity="[5,33]" probability="100.0"/>
      <item value="power arrow" quantity="[1,5]" probability="5.0"/>
      <item value="golden arrow" quantity="[3,15]" probability="10.0"/>
      <item value="composite bow" quantity="[1,1]" probability="2.5"/>
    </drops>
    <equips>
      <slot name="lhand" item="power arrow" quantity="10000"/>
      <slot name="rhand" item="composite bow" quantity="1"/>
    </equips>
    <ai>
      <profile name="brave"/>
      <profile name="offensive"/>
      <profile name="human"/>
      <profile name="archer"/>
      <profile name="patrolling"/>
    </ai>
  </creature>

  <creature name="mithrilbourgh sergeant">
    <type class="human" subclass="mithril_sergeant" tileid="human_soldier.png:7"/>
    <description/>
    <attributes>
      <atk value="547"/>
      <def value="80"/>
      <hp value="650"/>
      <speed value="1.0"/>
      <size value="1,1"/>
    </attributes>
    <level value="76"/>
    <experience value="5140"/>
    <respawn value="2570"/>
    <corpse name="humanoid"/>
    <drops>
      <item value="money" quantity="[5,63]" probability="100.0"/>
      <item value="stone armor" quantity="[1,1]" probability="0.1"/>
      <item value="chaos boots" quantity="[1,1]" probability="0.7"/>
    </drops>
    <equips>
    </equips>
    <ai>
      <profile name="brave"/>
      <profile name="offensive"/>
      <profile name="human"/>
      <profile name="patrolling"/>
      <profile name="attack weakest"/>
    </ai>
  </creature>

  <creature name="mithrilbourgh lieutenant">
    <type class="human" subclass="mithril_lieutenant" tileid="human_soldier.png:6"/>
    <description/>
    <attributes>
      <atk value="577"/>
      <def value="80"/>
      <hp value="760"/>
      <speed value="1.0"/>
      <size value="1,1"/>
    </attributes>
    <level value="83"/>
    <experience value="6540"/>
    <respawn value="3010"/>
    <corpse name="humanoid"/>
    <drops>
      <item value="money" quantity="[5,63]" probability="100.0"/>
      <item value="stone armor" quantity="[1,1]" probability="0.1"/>
      <item value="chaos boots" quantity="[1,1]" probability="1.0"/>
      <item value="chaos helmet" quantity="[1,1]" probability="0.4"/>
    </drops>
    <equips>
    </equips>
    <ai>
      <profile name="brave"/>
      <profile name="offensive"/>
      <profile name="human"/>
      <profile name="attack weakest"/>
    </ai>
  </creature>

  <creature name="mithrilbourgh colonel">
    <type class="human" subclass="mithril_colonel" tileid="human_soldier.png:1"/>
    <description/>
    <attributes>
      <atk value="610"/>
      <def value="82"/>
      <hp value="860"/>
      <speed value="1.0"/>
      <size value="1,1"/>
    </attributes>
    <level value="89"/>
    <experience value="7930"/>
    <respawn value="3450"/>
    <corpse name="humanoid"/>
    <drops>
      <item value="money" quantity="[5,95]" probability="100.0"/>
      <item value="stone armor" quantity="[1,1]" probability="0.7"/>
      <item value="chaos boots" quantity="[1,1]" probability="1.0"/>
    </drops>
    <equips>
    </equips>
    <ai>
      <profile name="brave"/>
      <profile name="offensive"/>
      <profile name="human"/>
      <profile name="patrolling"/>
      <profile name="attack weakest"/>
    </ai>
  </creature>

  <creature name="mithrilbourgh wizard">
    <type class="human" subclass="mithril_wizard" tileid="human_soldier.png:8"/>
    <description/>
    <attributes>
      <atk value="634"/>
      <def value="80"/>
      <hp value="911"/>
      <speed value="1.0"/>
      <size value="1,1"/>
    </attributes>
    <level value="92"/>
    <experience value="8700"/>
    <respawn value="3690"/>
    <corpse name="humanoid"/>
    <drops>
      <item value="money" quantity="[5,93]" probability="100.0"/>
      <item value="empty scroll" quantity="[1,2]" probability="10.0"/>
      <item value="scroll eraser" quantity="[1,1]" probability="1.0"/>
    </drops>
    <equips>
    </equips>
    <abilities>
      <susceptibility type="dark" value="0.9"/>
      <susceptibility type="light" value="0.9"/>
    </abilities>
    <ai>
      <profile name="brave"/>
      <profile name="offensive"/>
      <profile name="human"/>
    </ai>
  </creature>

  <creature name="mithrilbourgh general">
    <type class="human" subclass="mithril_general" tileid="human_soldier.png:4"/>
    <description>You see a mithrilbourgh general. Some call him Hawkeyes. He cast his gaze over the city walls and saw you coming from miles away.</description>
    <attributes>
      <atk value="624"/>
      <def value="83"/>
      <hp value="960"/>
      <speed value="1.0"/>
      <size value="1,1"/>
    </attributes>
    <level value="95"/>
    <experience value="9520"/>
    <respawn value="3940"/>
    <corpse name="humanoid"/>
    <drops>
      <item value="money" quantity="[5,100]" probability="100.0"/>
      <item value="ice armor" quantity="[1,1]" probability="0.1"/>
      <item value="chaos boots" quantity="[1,1]" probability="2.0"/>
      <item value="shadow cloak" quantity="[1,1]" probability="1.0"/>
      <item value="magic plate shield" quantity="[1,1]" probability="1.0"/>
      <item value="ice sword" quantity="[1,1]" probability="0.1"/>
    </drops>
    <equips>
    </equips>
    <ai>
      <profile name="brave"/>
      <profile name="offensive"/>
      <profile name="human"/>
      <profile name="attack weakest"/>
    </ai>
  </creature>

</creatures>
