<?xml version="1.0" encoding="ISO-8859-1"?>

<creatures xmlns="stendhal" xmlns:xsi="http://www.w3.org/2001/XMLSchema-instance"
    xsi:schemaLocation="stendhal ../creatures.xsd">

  <creature name="killer bee">
    <type class="insect" subclass="killer_bee" tileid="insect.png:0"/>
    <description>You see a killer bee which will sting you to death!</description>
    <attributes>
      <atk value="170"/>
      <ratk value="170"/>
      <def value="25"/>
      <hp value="100"/>
      <speed value="0.6"/>
      <size value="1,1"/>
    </attributes>
    <level value="15"/>
    <experience value="200"/>
    <respawn value="1000"/>
    <corpse name="small_boneless"/>
    <drops>
      <item value="honey" quantity="[1,2]" probability="15.0"/>
      <item value="poison" quantity="[1,1]" probability="15.0"/>
    </drops>
    <equips>
      <slot name="lhand" item="steel arrow" quantity="10000"/>
      <slot name="rhand" item="dummy_ranged" quantity="1"/>
    </equips>
    <ai>
      <says>
        <noise state="idle follow fight" value="BbzzZZzzz!"/>
        <sound value="bee-1"/>
      </says>
      <profile name="poisonous" params="10,poison"/>
      <profile name="brave"/>
      <profile name="offensive"/>
      <profile name="archer"/>
      <profile name="patrolling"/>
      <profile name="active_idle"/>
      <profile name="flying"/>
    </ai>
  </creature>

  <creature name="tiny scarab">
    <type class="insect" subclass="scarab_tiny" tileid="insect.png:1"/>
    <description></description>
    <attributes>
      <atk value="182"/>
      <def value="42"/>
      <hp value="180"/>
      <speed value="0.8"/>
      <size value="1,1"/>
    </attributes>
    <level value="23"/>
    <experience value="364"/>
    <respawn value="1290"/>
    <corpse name="carapace" harmless="carapace"/>
    <ai>
      <profile name="brave"/>
      <profile name="offensive"/>
      <profile name="human"/>
      <profile name="patrolling"/>
    </ai>
  </creature>

<!-- disabled
  <creature name="scarab">
    <type class="insect" subclass="scarab" tileid="insect.png:2"/>
    <description></description>
    <attributes>
      <atk value="1"/>
      <def value="1"/>
      <hp value="1"/>
      <speed value="0.9"/>
      <size value="1,1"/>
    </attributes>
    <level value="1"/>
    <experience value="1"/>
    <respawn value="1000"/>
    <corpse name="carapace" harmless="carapace"/>
    <ai>
      <profile name="brave"/>
      <profile name="offensive"/>
      <profile name="human"/>
      <profile name="patrolling"/>
    </ai>
  </creature>

  <creature name="red scarab">
    <type class="insect" subclass="scarab_red" tileid="insect.png:3"/>
    <description></description>
    <attributes>
      <atk value="1"/>
      <def value="1"/>
      <hp value="1"/>
      <speed value="0.9"/>
      <size value="1,1"/>
    </attributes>
    <level value="1"/>
    <experience value="1"/>
    <respawn value="1000"/>
    <corpse name="carapace" harmless="carapace"/>
    <ai>
      <profile name="brave"/>
      <profile name="offensive"/>
      <profile name="human"/>
      <profile name="patrolling"/>
    </ai>
  </creature>
-->

  <creature name="water scarab">
    <type class="insect" subclass="scarab_blue" tileid="insect.png:4"/>
    <description></description>
    <attributes>
      <atk value="358"/>
      <def value="59"/>
      <hp value="1450"/>
      <speed value="0.9"/>
      <size value="1,1"/>
    </attributes>
    <level value="94"/>
    <experience value="9110"/>
    <respawn value="3900"/> <!-- 19.5 minutes -->
    <corpse name="carapace" harmless="carapace"/>
    <drops>
      <item value="placid ring" quantity="[1,1]" probability="0.75"/>
    </drops>
    <ai>
      <profile name="brave"/>
      <profile name="offensive"/>
      <profile name="human"/>
      <profile name="patrolling"/>
    </ai>
  </creature>

</creatures>
