<?xml version="1.0" encoding="ISO-8859-1"?>
<creatures xmlns="stendhal" xmlns:xsi="http://www.w3.org/2001/XMLSchema-instance"
    xsi:schemaLocation="stendhal ../creatures.xsd ">
  
  <!-- START: gnome -->
  
  <creature name="gnome">
    <type class="gnome" subclass="gnome" tileid="gnome.png:0"/>
    <description>You see a gnome who lives in the mountains.</description>
    <attributes>
      <atk value="51"/>
      <def value="7"/>
      <hp value="50"/>
      <speed value="0.5"/>
      <size value="1,1"/>
    </attributes>
    <level value="2"/>
    <experience value="20"/>
    <respawn value="900"/>
    <corpse name="tiny_humanoid" harmless="gnome" />
    <drops>
      <item value="money" quantity="[2,5]" probability="70.0"/>
      <item value="minor potion" quantity="[1,1]" probability="5.0"/>
      <item value="button mushroom" quantity="[3,6]" probability="10.0"/>
      <item value="leather armor" quantity="[1,1]" probability="10.0"/>
      <item value="buckler" quantity="[1,1]" probability="5.0"/>
    </drops>
    <equips>
    </equips>
    <ai>
      <says>
        <noise state="idle follow fight" value="Giiiiiaaants! Run away!"/>
      </says>
      <profile name="offensive"/>
      <profile name="coward"/>
      <profile name="human"/>
      <profile name="patrolling"/>
    </ai>
  </creature>
  
  <creature name="mage gnome">
    <type class="gnome" subclass="woman_gnome" tileid="gnome.png:1"/>
    <description>You see a mage gnome, she cleans the dirty mountain.</description>
    <attributes>
      <atk value="52"/>
      <def value="7"/>
      <hp value="50"/>
      <speed value="0.5"/>
      <size value="1,1"/>
    </attributes>
    <level value="2"/>
    <experience value="20"/>
    <respawn value="900"/>
    <corpse name="tiny_humanoid" harmless="gnome" />
    <drops>
      <item value="money" quantity="[2,5]" probability="70.0"/>
      <item value="antidote" quantity="[1,1]" probability="10.0"/>
      <item value="porcini" quantity="[1,10]" probability="10.0"/>
      <item value="leather armor" quantity="[1,1]" probability="10.0"/>
    </drops>
    <equips>
    </equips>
    <ai>
      <says>
        <noise state="idle follow fight" value="Giiiiiaaants! Run away!"/>
      </says>
      <profile name="offensive"/>
      <profile name="coward"/>
      <profile name="human"/>
      <profile name="patrolling"/>
    </ai>
  </creature>
  
  <!-- END: gnome -->
  
  <!-- START: militant -->
  
  <creature name="infantry gnome">
    <type class="gnome" subclass="infantryman" tileid="gnome_patrol.png:0"/>
    <description>You see an infantry gnome who will protect his little town against the humans!</description>
    <attributes>
      <atk value="58"/>
      <def value="15"/>
      <hp value="60"/>
      <speed value="0.5"/>
      <size value="1,1"/>
    </attributes>
    <level value="5"/>
    <experience value="50"/>
    <respawn value="1200"/>
    <corpse name="tiny_humanoid" harmless="gnome_military" />
    <drops>
      <item value="money" quantity="[4,10]" probability="70.0"/>
      <item value="carrot" quantity="[2,10]" probability="20.0"/>
      <item value="porcini" quantity="[1,10]" probability="10.0"/>
      <item value="potion" quantity="[1,1]" probability="20.0"/>
    </drops>
    <equips>
          <slot name="rhand" item="dagger"/>
    </equips>
    <ai>
      <says>
        <noise state="idle follow fight" value="Ready! Aim! Runnnnnnnnnnn"/>
      </says>
      <profile name="brave"/>
      <profile name="offensive"/>
      <profile name="human"/>
      <profile name="patrolling"/>
    </ai>
  </creature>
  
  <creature name="cavalryman gnome">
    <type class="gnome" subclass="cavalryman" tileid="gnome_patrol.png:1"/>
    <description>You see a cavalryman gnome who does long travels to search for gold.</description>
    <attributes>
      <atk value="90"/>
      <def value="14"/>
      <hp value="65"/>
      <speed value="0.5"/>
      <size value="1,1"/>
    </attributes>
    <level value="5"/>
    <experience value="55"/>
    <respawn value="1200"/>
    <corpse name="tiny_humanoid" harmless="gnome_military" />
    <drops>
      <item value="money" quantity="[6,14]" probability="70.0"/>
      <item value="chain boots" quantity="[1,1]" probability="15.0"/>
      <item value="robins hat" quantity="[1,1]" probability="20.0"/>
      <item value="potion" quantity="[1,1]" probability="20.0"/>
    </drops>
    <equips>
    </equips>
    <ai>
      <says>
        <noise state="idle follow fight" value="Ready! Aim! Runnnnnnnnnnn"/>
        <sound value="pig-3" />
      </says>
      <profile name="brave"/>
      <profile name="offensive"/>
      <profile name="human"/>
      <profile name="patrolling"/>
    </ai>
  </creature>
  
  <!-- END: militant -->
  
</creatures>